Symbol,Name,Last Sale,Net Change,% Change,Market Cap,Country,IPO Year,Volume,Sector,Industry
VLO,Valero Energy Corporation Common Stock,$144.01,3.85,2.747%,45591438684.00,United States,,2465319,Energy,Integrated oil Companies
VLTO,Veralto Corp Common Stock ,$102.84,0.16,0.156%,25433131581.00,United States,2023,1158926,Industrials,Electrical Products
VMC,Vulcan Materials Company (Holding Company) Common Stock,$278.74,-0.54,-0.193%,36810755334.00,United States,,491553,Industrials,Mining & Quarrying of Nonmetallic Minerals (No Fuels)
VRT,Vertiv Holdings LLC Class A Common Stock,$123.02,2.15,1.779%,46173833736.00,United States,2018,7583753,Technology,Industrial Machinery/Components
VST,Vistra Corp. Common Stock,$146.63,4.48,3.152%,49887370492.00,United States,,5743992,Utilities,Electric Utilities: Central
VTR,Ventas Inc. Common Stock,$63.86,0.26,0.409%,26779979967.00,United States,,2490022,Real Estate,Real Estate Investment Trusts
WAB,Westinghouse Air Brake Technologies Corporation Common Stock,$195.46,0.29,0.149%,33597545907.00,United States,,661068,Industrials,Railroads
WAT,Waters Corporation Common Stock,$355.47,-2.99,-0.834%,21106448572.00,United States,1995,463130,Industrials,Biotechnology: Laboratory Analytical Instruments
WBS,Webster Financial Corporation Common Stock,$60.53,0.46,0.766%,10375469393.00,United States,,1366653,Finance,Major Banks
WCN,Waste Connections Inc. Common Shares,$186.01,2.51,1.368%,47997540680.00,Canada,,1005642,Utilities,Environmental Services
WDS,Woodside Energy Group Limited American Depositary Shares each representing one Ordinary Share,$15.86,0.49,3.188%,30114171368.00,Australia,2022,1865984,Energy,Oil & Gas Production
WEC,WEC Energy Group Inc. Common Stock,$99.28,1.30,1.327%,31407669399.00,United States,,1958973,Utilities,Power Generation
WELL,Welltower Inc. Common Stock,$137.01,0.99,0.728%,85314691546.00,United States,,2330702,Real Estate,Real Estate Investment Trusts
WES,Western Midstream Partners LP Common Units Representing Limited Partner Interests,$38.03,-0.17,-0.445%,14472522889.00,United States,2012,1922379,Utilities,Natural Gas Distribution
WIT,Wipro Limited Common Stock,$6.70,-0.02,-0.298%,35008426248.00,India,,4192709,Technology,EDP Services
WLK,Westlake Corporation Common Stock,$127.04,0.38,0.30%,16350784705.00,United States,2004,434969,Industrials,Major Chemicals
WM,Waste Management Inc. Common Stock,$218.31,0.41,0.188%,87622111256.00,United States,,986744,Utilities,Environmental Services
WMB,Williams Companies Inc. (The) Common Stock,$57.86,1.31,2.317%,70532022632.00,United States,,8605110,Utilities,Natural Gas Distribution
WMS,Advanced Drainage Systems Inc. Common Stock,$133.23,1.81,1.377%,10330140998.00,United States,2014,663011,Consumer Discretionary,Containers/Packaging
WPC,W. P. Carey Inc. REIT,$56.23,0.46,0.825%,12305795150.00,United States,,1023801,Real Estate,Real Estate Investment Trusts
WPM,Wheaton Precious Metals Corp Common Shares (Canada),$60.90,2.23,3.801%,27628242531.00,Canada,,1820581,Basic Materials,Precious Metals
WPP,WPP plc American Depositary Shares,$51.61,0.16,0.311%,11132839394.00,Ireland,,155256,Consumer Discretionary,Advertising
WRB,W.R. Berkley Corporation Common Stock,$60.83,0.09,0.148%,23180434570.00,United States,,1330259,Finance,Property-Casualty Insurers
WSM,Williams-Sonoma Inc. Common Stock (DE),$133.89,3.24,2.48%,16915574500.00,United States,,2762082,Consumer Discretionary,Home Furnishings
WSO,Watsco Inc. Common Stock,$527.17,6.43,1.235%,21288006555.00,United States,,181666,Consumer Discretionary,Industrial Machinery/Components
WST,West Pharmaceutical Services Inc. Common Stock,$307.21,-7.28,-2.315%,22248869836.00,United States,,592102,Health Care,Medical/Dental Instruments
WTRG,Essential Utilities Inc. Common Stock,$38.81,0.21,0.544%,10657637076.00,United States,,1156861,Utilities,Water Supply
WY,Weyerhaeuser Company Common Stock,$31.02,0.09,0.291%,22538573640.00,United States,,1918330,Real Estate,Real Estate Investment Trusts
XPEV,XPeng Inc. American depositary shares each representing two Class A ordinary shares,$13.01,0.27,2.119%,12264768205.00,China,2020,12359315,Consumer Discretionary,Auto Manufacturing
XPO,XPO Inc. Common Stock,$144.47,-1.32,-0.905%,16816581048.00,United States,,1357104,Consumer Discretionary,Transportation Services
XYL,Xylem Inc. Common Stock New,$122.46,0.68,0.558%,29751008329.00,United States,2011,1459279,Industrials,Fluid Controls
YPF,YPF Sociedad Anonima Common Stock,$34.94,2.55,7.873%,13742348987.00,Argentina,1993,4035197,Energy,Integrated oil Companies
YUM,Yum! Brands Inc.,$134.01,0.42,0.314%,37398419155.00,United States,,1444392,Consumer Discretionary,Restaurants
YUMC,Yum China Holdings Inc. Common Stock,$47.66,0.45,0.953%,18099562296.00,United States,2016,1254339,Consumer Discretionary,Restaurants
ZBH,Zimmer Biomet Holdings Inc. Common Stock,$113.02,0.48,0.427%,22499310930.00,United States,,1887963,Health Care,Industrial Specialties
ZTO,ZTO Express (Cayman) Inc. American Depositary Shares each representing one Class A ordinary share.,$20.80,-0.27,-1.281%,16907626590.00,China,2016,5164646,Industrials,Trucking Freight/Courier Services
ZTS,Zoetis Inc. Class A Common Stock,$176.42,1.28,0.731%,79594531241.00,United States,2013,3172861,Health Care,Biotechnology: Pharmaceutical Preparations
